{"$ref":"#/definitions/manifest","$schema":"http://json-schema.org/draft-07/schema#","definitions":{"manifest":{"additionalProperties":false,"properties":{"fixture":{"type":"boolean"},"module_compatibility":{"additionalProperties":false,"properties":{"min_consumer_version":{"pattern":"^\\d+\\.\\d+\\.\\d+$","type":"string"},"projection":{"const":1,"type":"number"}},"required":["projection","min_consumer_version"],"type":"object"},"objects":{"additionalProperties":false,"properties":{"catalog":{"additionalProperties":false,"properties":{"path":{"pattern":"^v1\\/revisions\\/[a-f0-9]{64}\\/catalog\\.json$","type":"string"},"sha256":{"$ref":"#/definitions/manifest/properties/revision"},"size":{"exclusiveMinimum":0,"maximum":100000000,"type":"integer"}},"required":["path","sha256","size"],"type":"object"}},"required":["catalog"],"type":"object"},"publication_sequence":{"exclusiveMinimum":0,"maximum":9007199254740991,"type":"integer"},"published_at":{"format":"date-time","type":"string"},"revision":{"pattern":"^[a-f0-9]{64}$","type":"string"},"schema_version":{"const":1,"type":"number"}},"required":["schema_version","revision","publication_sequence","published_at","objects","module_compatibility","fixture"],"type":"object"}}}
