{"fixture":true,"module_compatibility":{"min_consumer_version":"1.0.0","projection":1},"objects":{"catalog":{"path":"v1/revisions/752a1f1eb377ff4217eea4dd5d258aba49a42a075936e9652560456bbd9dbacd/catalog.json","sha256":"19f1b5521f0c581ecc2ecb093014c2a8381b170e801d802f7a71bf17567e3b7e","size":2099}},"publication_sequence":1,"published_at":"2026-10-25T00:00:00.000Z","revision":"752a1f1eb377ff4217eea4dd5d258aba49a42a075936e9652560456bbd9dbacd","schema_version":1}
